{
  "schemaVersion": 1,
  "channel": "candidate",
  "generatedAt": "2026-09-28T09:42:17.415Z",
  "status": "unverified",
  "components": {
    "gsd": {
      "package": "@opengsd/gsd-core",
      "version": "1.15.0",
      "integrity": "sha512-GwdlJeupozyM22g2INdxiNfkpDm5hFS7G42leRqQwHb/0BclBG3TpgyGtWIkf47shjkfGRtrK5iK+pPZ61DvMA==",
      "profile": "standard"
    },
    "ecc": {
      "package": "ecc-universal",
      "version": "2.2.1",
      "integrity": "sha512-D8vFXQ++Aub1CD2RPyYfPEXVt51eEHzvImLd1XaOos/gUxYRWU+BRDXMDnmRrjDfWwX5+uFEJULYpqPYFPSGuw==",
      "skills": [
        "unified-memory",
        "documentation-lookup",
        "deep-research",
        "accessibility",
        "agent-harness-construction",
        "ai-regression-testing",
        "browser-qa",
        "click-path-audit",
        "database-migrations",
        "deployment-patterns",
        "docker-patterns",
        "eval-harness",
        "frontend-a11y",
        "inherit-legacy-style",
        "mcp-server-patterns",
        "postgres-patterns",
        "redis-patterns",
        "scientific-db-pubmed-database",
        "scientific-db-uspto-database",
        "scientific-thinking-literature-review",
        "scientific-thinking-scholar-evaluation",
        "security-review"
      ],
      "sourceSha256": {
        "unified-memory": "a6eb9a96b92dfd4a700bceff15195ca1fd4b7fad2944bb014c08812d1a0dc8b0",
        "documentation-lookup": "81ad2b5b4acbe02259f4b6cbfd9111d81d5cfe51025051b6048959c45f6516c1",
        "deep-research": "72e184f5d0f31ca4d45286753409d8c8431b025e8ac3800dcc9f32d9e930f58a",
        "accessibility": "d8578fe750e7321658450386e2112a46ea1aedca0235fbf97f3db2457e599b3a",
        "agent-harness-construction": "e7fb390a6663b46ea5d3c2876753a5ce32ba3bad1889686b21a42894caa1742d",
        "ai-regression-testing": "83f2f5c4083af5762dd658f742d4a390eb3a6f969d835f69e8f47efba296c127",
        "browser-qa": "c501257d2c9ca711342b56d7adfb04897f17c6946dc6cdb88a5c75c87e4aa951",
        "click-path-audit": "662fc5d02483bcd8ff799d6d3109a38da673182341cfc14445e9076fcd920162",
        "database-migrations": "ad7f2f04ca03e592a16e2a539d8c6e90bf4e08892408820ce99a53e9d07775de",
        "deployment-patterns": "b864abd1954570c4a469b7e1deb897e57858d25db2fd98d035ff7bca4a15b9b6",
        "docker-patterns": "2a880cf2f6401874151daa9bcc0eacd10cf79f5f48b97f98e93a877a8f3fd12b",
        "eval-harness": "9d3afbeca1479975c2575daa7467ca3666e7627fcebe02ea050f2db93917c4fd",
        "frontend-a11y": "62afdfd4e616ed21bf9037d47f771f3504d21838c898b9e9de8ac0da9b0bf3f7",
        "inherit-legacy-style": "14e7b20424f123b594d3ee3d6ac3e722b21e5a6816fe90bacf8a23e6c3af5b6d",
        "mcp-server-patterns": "eacb07c953e0440c758e3ee7d92984d2c9128e3444005ea7ad5da7bc0201d43d",
        "postgres-patterns": "9c8c391ae9e9aa87faa7ca091e1d395c97766df14080d0bfbea8a97721776163",
        "redis-patterns": "6cabb1cd03174a0584ff3538371c780aba90da156db15260691278ed3307d8fe",
        "scientific-db-pubmed-database": "516c24ed8c74713191ec2424accf11f8f5518356b046561e5017f40687289838",
        "scientific-db-uspto-database": "96849e8dc762df699fea11a283e9424660dd3b606e7e513617e4e9a9ce2011be",
        "scientific-thinking-literature-review": "456e7ef6b33300bfefeeee46fc8dae55fec62e4a8b418ba2323e12779de70195",
        "scientific-thinking-scholar-evaluation": "e9f8a3bce2bce769a96611a52804a2b3955f2796ee2749bc8275aea38a26cd2d",
        "security-review": "fe6f9151fb15c1dffd47a55080c3ad147af7c95dd0ad3714735dec6824b060b7"
      },
      "targetSha256": {
        "unified-memory": {
          "claude": "a6eb9a96b92dfd4a700bceff15195ca1fd4b7fad2944bb014c08812d1a0dc8b0",
          "codex": "a6eb9a96b92dfd4a700bceff15195ca1fd4b7fad2944bb014c08812d1a0dc8b0",
          "antigravity": "a6eb9a96b92dfd4a700bceff15195ca1fd4b7fad2944bb014c08812d1a0dc8b0",
          "pi": "a6eb9a96b92dfd4a700bceff15195ca1fd4b7fad2944bb014c08812d1a0dc8b0",
          "hermes": "a6eb9a96b92dfd4a700bceff15195ca1fd4b7fad2944bb014c08812d1a0dc8b0"
        },
        "documentation-lookup": {
          "claude": "81ad2b5b4acbe02259f4b6cbfd9111d81d5cfe51025051b6048959c45f6516c1",
          "codex": "81ad2b5b4acbe02259f4b6cbfd9111d81d5cfe51025051b6048959c45f6516c1",
          "antigravity": "93c880e4c6b18e508d8a9c79e08e192a9d3d1bbf5885f0b855d0243fc20e7143",
          "pi": "81ad2b5b4acbe02259f4b6cbfd9111d81d5cfe51025051b6048959c45f6516c1",
          "hermes": "81ad2b5b4acbe02259f4b6cbfd9111d81d5cfe51025051b6048959c45f6516c1"
        },
        "deep-research": {
          "claude": "fdd97098a3a4a02513baf0428faacbe390b42fd4f86362387938e3455c80d90c",
          "codex": "fdd97098a3a4a02513baf0428faacbe390b42fd4f86362387938e3455c80d90c",
          "antigravity": "fdd97098a3a4a02513baf0428faacbe390b42fd4f86362387938e3455c80d90c",
          "pi": "fdd97098a3a4a02513baf0428faacbe390b42fd4f86362387938e3455c80d90c",
          "hermes": "fdd97098a3a4a02513baf0428faacbe390b42fd4f86362387938e3455c80d90c"
        }
      }
    },
    "mcp": {
      "context7": {
        "package": "@upstash/context7-mcp",
        "version": "4.1.1",
        "integrity": "sha512-fUARTIZGVKzlzQKDhKUg4aIQ3yEU/12STdfxJDDnLMSN7yyHiPvNHI05iFwxkv3vC8G76Wp27MwK6Jucl/C5pA=="
      },
      "exa": {
        "package": "exa-mcp-server",
        "version": "3.4.1",
        "integrity": "sha512-X6g4J9LXLJZ0uK52G8KE/KCaxpaD+wkEHzjkoDTYkC+afxfm5xqWgih3i0hgTfyufl6PggkLeR0L6rDAxW6ETg=="
      },
      "firecrawl": {
        "package": "firecrawl-mcp",
        "version": "3.25.5",
        "integrity": "sha512-maWfL4TQRvu2nHnaHGsSxBP8SwZB7nVyHAicRIZTdfZdqJDsvz1SiTqN6tZOLjmjyg7UgLmbMibXb7Ndtq/Iog=="
      }
    },
    "mcpBridges": {
      "pi": {
        "package": "pi-mcp-adapter",
        "version": "3.1.0",
        "integrity": "sha512-jW3ucLFvt1YtV7yHctXloQshaW+hWEQYylNGHR6chR7pOHJNC8dJiSoeKuz9bmRFIZfAY+vhM0DUTmIkXEX8dQ=="
      }
    },
    "ownedSkills": {
      "alpha-aos-ship": {
        "sourceSha256": "0b9d85550717d43ac07d36ba0a6400e49d2e035eb1600f6a73d922345b91947a",
        "targetSha256": {
          "claude": "808cc67dbd6c8ba2574f1325cd5c4b32218ddad99bc3cc4e6e03c141872b2a48"
        },
        "upstreamWorkflow": "gsd-core/workflows/ship.md"
      },
      "alpha-aos-control": {
        "sourceSha256": "a66debb56c9ffd5b68e22451a0b88ae8485b97787f512d61a9a4e80aef2ddd84",
        "targetSha256": {
          "claude": "a66debb56c9ffd5b68e22451a0b88ae8485b97787f512d61a9a4e80aef2ddd84",
          "codex": "a66debb56c9ffd5b68e22451a0b88ae8485b97787f512d61a9a4e80aef2ddd84",
          "antigravity": "a66debb56c9ffd5b68e22451a0b88ae8485b97787f512d61a9a4e80aef2ddd84",
          "pi": "a66debb56c9ffd5b68e22451a0b88ae8485b97787f512d61a9a4e80aef2ddd84",
          "hermes": "a66debb56c9ffd5b68e22451a0b88ae8485b97787f512d61a9a4e80aef2ddd84"
        }
      }
    }
  }
}
