{
  "schemaVersion": 1,
  "channel": "stable",
  "generatedAt": "2026-10-10T18:08:41.087Z",
  "components": {
    "gsd": {
      "package": "@opengsd/gsd-core",
      "version": "1.16.0",
      "integrity": "sha512-A3OgmNH8/M0eALNpKZp0bjP0L5puu6rne1keqdFaM+NvqybuYZ2kJOcUH+fCKu6FQBGV0fAUEUE1bs6xqRfF7Q==",
      "profile": "standard"
    },
    "ecc": {
      "package": "ecc-universal",
      "version": "2.2.3",
      "integrity": "sha512-2xDcL0lCJ9O7GTGm5fNqEZuuWsJOkvIi68/QWTho3DbKFta02EoycXFQh7TCrp4M4YFur0vKQOlOon4jgmJ55A==",
      "skills": [
        "unified-memory",
        "documentation-lookup",
        "deep-research",
        "accessibility",
        "agent-harness-construction",
        "ai-regression-testing",
        "browser-qa",
        "click-path-audit",
        "database-migrations",
        "deployment-patterns",
        "docker-patterns",
        "eval-harness",
        "frontend-a11y",
        "inherit-legacy-style",
        "mcp-server-patterns",
        "postgres-patterns",
        "redis-patterns",
        "scientific-db-pubmed-database",
        "scientific-db-uspto-database",
        "scientific-thinking-literature-review",
        "scientific-thinking-scholar-evaluation",
        "security-review"
      ],
      "sourceSha256": {
        "unified-memory": "c42e96155783a44a50f13ab63e9d7f33c9d03b7a1f30777ef434401469c1630a",
        "documentation-lookup": "81ad2b5b4acbe02259f4b6cbfd9111d81d5cfe51025051b6048959c45f6516c1",
        "deep-research": "ca02a97ff8cd794c55a1313ab423a6a165fdf2ce59059a73e08f7cfd957b5319",
        "accessibility": "2762f21d09d199009ed4f95b28c911436b367c30963dc5ddb48b8e1ad7fc1585",
        "agent-harness-construction": "e7fb390a6663b46ea5d3c2876753a5ce32ba3bad1889686b21a42894caa1742d",
        "ai-regression-testing": "83f2f5c4083af5762dd658f742d4a390eb3a6f969d835f69e8f47efba296c127",
        "browser-qa": "6eb78a2460adcde116e6b44fcdff7ae37aeec6208241a24417cb2db4b3b254cd",
        "click-path-audit": "662fc5d02483bcd8ff799d6d3109a38da673182341cfc14445e9076fcd920162",
        "database-migrations": "dad2f1964295eee14a96e06213ce3f60992bbcdc1f37a50c828bbc2e1abd79dd",
        "deployment-patterns": "b864abd1954570c4a469b7e1deb897e57858d25db2fd98d035ff7bca4a15b9b6",
        "docker-patterns": "2a880cf2f6401874151daa9bcc0eacd10cf79f5f48b97f98e93a877a8f3fd12b",
        "eval-harness": "3a5339a5a80099a5c9d55da9b6c8e05a690f5befc6f78d779c75dd79d818ca07",
        "frontend-a11y": "e00991a3f4d47fcf1529dd74a080afcf46137dc5061e70dc6e3da7b27f2ae3f3",
        "inherit-legacy-style": "ccce44b6240e346e2d564a035f45abf01842cfc03f4c0253050b8304c505f709",
        "mcp-server-patterns": "eacb07c953e0440c758e3ee7d92984d2c9128e3444005ea7ad5da7bc0201d43d",
        "postgres-patterns": "9c8c391ae9e9aa87faa7ca091e1d395c97766df14080d0bfbea8a97721776163",
        "redis-patterns": "6cabb1cd03174a0584ff3538371c780aba90da156db15260691278ed3307d8fe",
        "scientific-db-pubmed-database": "5b4c406c73b0fdee3dbbc352fd7d51ee28702d589ea44f3229402fb513354a54",
        "scientific-db-uspto-database": "aeb87193dbafc68b5218612e4845ae3d6c3a040203ff8a625ed98661255fef58",
        "scientific-thinking-literature-review": "380918f545c7e9b297b23bee4a0432deba977acbdb217232bf1ab9d5aa3c562e",
        "scientific-thinking-scholar-evaluation": "079ed9182c086fbb2168b723f36cb167d4cb2272a10a41b131f38945d2f0b145",
        "security-review": "b9eb6416eebc8dda046674f0a2dbb3be88aff526d182b60a0f55998d3d6d0d8d"
      },
      "targetSha256": {
        "unified-memory": {
          "claude": "c42e96155783a44a50f13ab63e9d7f33c9d03b7a1f30777ef434401469c1630a",
          "codex": "c42e96155783a44a50f13ab63e9d7f33c9d03b7a1f30777ef434401469c1630a",
          "antigravity": "c42e96155783a44a50f13ab63e9d7f33c9d03b7a1f30777ef434401469c1630a",
          "pi": "c42e96155783a44a50f13ab63e9d7f33c9d03b7a1f30777ef434401469c1630a",
          "hermes": "c42e96155783a44a50f13ab63e9d7f33c9d03b7a1f30777ef434401469c1630a"
        },
        "documentation-lookup": {
          "claude": "81ad2b5b4acbe02259f4b6cbfd9111d81d5cfe51025051b6048959c45f6516c1",
          "codex": "81ad2b5b4acbe02259f4b6cbfd9111d81d5cfe51025051b6048959c45f6516c1",
          "antigravity": "93c880e4c6b18e508d8a9c79e08e192a9d3d1bbf5885f0b855d0243fc20e7143",
          "pi": "81ad2b5b4acbe02259f4b6cbfd9111d81d5cfe51025051b6048959c45f6516c1",
          "hermes": "81ad2b5b4acbe02259f4b6cbfd9111d81d5cfe51025051b6048959c45f6516c1"
        },
        "deep-research": {
          "claude": "4e976b0fa3dc41a1947cd26cf3b565e936a3e33834a442eaa4649126ce525351",
          "codex": "4e976b0fa3dc41a1947cd26cf3b565e936a3e33834a442eaa4649126ce525351",
          "antigravity": "4e976b0fa3dc41a1947cd26cf3b565e936a3e33834a442eaa4649126ce525351",
          "pi": "4e976b0fa3dc41a1947cd26cf3b565e936a3e33834a442eaa4649126ce525351",
          "hermes": "4e976b0fa3dc41a1947cd26cf3b565e936a3e33834a442eaa4649126ce525351"
        }
      }
    },
    "mcp": {
      "context7": {
        "package": "@upstash/context7-mcp",
        "version": "4.3.0",
        "integrity": "sha512-fuDt5nWjE5JkAPLjU0m+m0LlJphxyegAvAmcwHoA5jrzAhKo/rVV0RFA8TOwODGdDVdt/nPxNslkxeDIDp/rPA=="
      },
      "exa": {
        "package": "exa-mcp-server",
        "version": "3.4.2",
        "integrity": "sha512-2pqkOuXnABXrwVkB6VyMYA9ywr1aqjBGKlLtcgTBMkWtIn74yY+pMPn8Km2SAGfLeENfWaIHv1L7/kF0b+E5BQ=="
      },
      "firecrawl": {
        "package": "firecrawl-mcp",
        "version": "3.29.1",
        "integrity": "sha512-Y2B8/bNq4vE+kFTLFQbOR31hgvrmc07tuP+Ie+8wa0lgJAZVBKDGjKx+l+N6yyIgSkohtv6iRwuqZxqbTreoaQ=="
      }
    },
    "mcpBridges": {
      "pi": {
        "package": "pi-mcp-adapter",
        "version": "5.2.0",
        "integrity": "sha512-I1J8jEtInPYlwxoOk0WyVzHsBnP2ahYwSNKOKPEsDgwL+8dvUaGCcD220lSxwbMhaLIgnar6DCbufjoU6caHpw=="
      }
    },
    "ownedSkills": {
      "alpha-aos-ship": {
        "sourceSha256": "0b9d85550717d43ac07d36ba0a6400e49d2e035eb1600f6a73d922345b91947a",
        "targetSha256": {
          "claude": "808cc67dbd6c8ba2574f1325cd5c4b32218ddad99bc3cc4e6e03c141872b2a48"
        },
        "upstreamWorkflow": "gsd-core/workflows/ship.md"
      },
      "alpha-aos-control": {
        "sourceSha256": "a66debb56c9ffd5b68e22451a0b88ae8485b97787f512d61a9a4e80aef2ddd84",
        "targetSha256": {
          "claude": "a66debb56c9ffd5b68e22451a0b88ae8485b97787f512d61a9a4e80aef2ddd84",
          "codex": "a66debb56c9ffd5b68e22451a0b88ae8485b97787f512d61a9a4e80aef2ddd84",
          "antigravity": "a66debb56c9ffd5b68e22451a0b88ae8485b97787f512d61a9a4e80aef2ddd84",
          "pi": "a66debb56c9ffd5b68e22451a0b88ae8485b97787f512d61a9a4e80aef2ddd84",
          "hermes": "a66debb56c9ffd5b68e22451a0b88ae8485b97787f512d61a9a4e80aef2ddd84"
        }
      },
      "alpha-aos-task": {
        "sourceSha256": "3b3fbdb8056ddb1485da0f7488d328e314a2992414722047aad21974809529d9",
        "targetSha256": {
          "claude": "3b3fbdb8056ddb1485da0f7488d328e314a2992414722047aad21974809529d9",
          "codex": "3b3fbdb8056ddb1485da0f7488d328e314a2992414722047aad21974809529d9",
          "antigravity": "3b3fbdb8056ddb1485da0f7488d328e314a2992414722047aad21974809529d9",
          "pi": "3b3fbdb8056ddb1485da0f7488d328e314a2992414722047aad21974809529d9",
          "hermes": "3b3fbdb8056ddb1485da0f7488d328e314a2992414722047aad21974809529d9"
        }
      },
      "cli-anything": {
        "sourceSha256": "f238e56fe81491f4dd9e4d9df2ae0eb4a131dcb557fa648ca19388ac1574e3d1",
        "targetSha256": {
          "claude": "f238e56fe81491f4dd9e4d9df2ae0eb4a131dcb557fa648ca19388ac1574e3d1",
          "codex": "f238e56fe81491f4dd9e4d9df2ae0eb4a131dcb557fa648ca19388ac1574e3d1",
          "antigravity": "f238e56fe81491f4dd9e4d9df2ae0eb4a131dcb557fa648ca19388ac1574e3d1",
          "pi": "f238e56fe81491f4dd9e4d9df2ae0eb4a131dcb557fa648ca19388ac1574e3d1",
          "hermes": "f238e56fe81491f4dd9e4d9df2ae0eb4a131dcb557fa648ca19388ac1574e3d1"
        }
      },
      "computer-use": {
        "sourceSha256": "35e0394b8816c88a5408815d1db9b84b69a214d58c5410fec7a0e65f3ab483a1",
        "targetSha256": {
          "claude": "2064c830731d045e1aa89b34731f099ddb03066abc7fc6d4fb47bd48e21bb073",
          "codex": "2064c830731d045e1aa89b34731f099ddb03066abc7fc6d4fb47bd48e21bb073",
          "antigravity": "2064c830731d045e1aa89b34731f099ddb03066abc7fc6d4fb47bd48e21bb073",
          "pi": "2064c830731d045e1aa89b34731f099ddb03066abc7fc6d4fb47bd48e21bb073",
          "hermes": "2064c830731d045e1aa89b34731f099ddb03066abc7fc6d4fb47bd48e21bb073"
        }
      }
    }
  }
}
